{
  "id": "ebfca53a-8e40-4f15-95da-968d9b8d4a8e",
  "event_type": "anomaly.detected",
  "version": 1,
  "occurred_at": "2026-02-23T10:01:00Z",
  "org_id": "996e9e43-7bab-4e68-a831-0a766befbf54",
  "correlation": {"request_id": "req-1002"},
  "actor": {"actor_id": "sentry", "actor_type": "agent"},
  "source": "agents.sentry",
  "payload": {
    "fingerprint": "fp:org:echo:error_rate",
    "signal": "error_rate_spike",
    "tool_name": "echo",
    "window_size": 50,
    "observed_value": 0.72,
    "threshold_value": 0.35,
    "evidence_refs": ["audit:tool_call.finished:429"]
  }
}
