{
  "id": "6f5c4c45-5014-4a85-bcd7-b10e7b4bb7f1",
  "event_type": "tool_call.finished",
  "version": 1,
  "occurred_at": "2026-02-23T10:00:00Z",
  "org_id": "996e9e43-7bab-4e68-a831-0a766befbf54",
  "correlation": {"request_id": "req-1001"},
  "actor": {"actor_id": "gateway", "actor_type": "system"},
  "source": "gateway.run",
  "payload": {
    "request_id": "req-1001",
    "tool_name": "world.move",
    "status": "success",
    "decision": "allow",
    "latency_ms": 42,
    "http_status": 200
  }
}
